<?xml version="1.0" encoding="UTF-8"?>
<MMR_ART_15 xmlns="http://dd.eionet.europa.eu/namespaces/4" xmlns:xsi="https://www.w3.org/2001/XMLSchema-instance" xsi:schemaLocation="http://dd.eionet.europa.eu/namespaces/4 https://dd.eionet.europa.eu/schemas/mmr-national-adaptation-actions/mmr-art15.xsd">
    <GI_mc/>
    <GI_Rep/>
    <plf>
        <Intro_pol/>
        <NAS/>
        <IMeans/>
        <MRE/>
        <Review/>
    </plf>
    <psaa>
        <Intro_sect/>
        <Sectors/>
        <Mainstreaming/>
    </psaa>
    <ivai>
        <Intro_ass/>
        <Obs_proj/>
        <IVA/>
        <Research/>
        <Mon/>
    </ivai>
    <espcb>
        <Intro_stake/>
        <Governance/>
        <Knowledge/>
        <International/>
    </espcb>       
    <con>
        <Org/>
        <contact/>
        <Ent/>
        <Name/>
        <Title/>
        <email/>
        <phone/>
        <website/>
        <address/>
    </con>
    <nas></nas>
    <nap></nap>
    <iva></iva>
    <rpr></rpr>
    <met></met>
    <cps></cps>
    <wpp></wpp>
    <mim></mim>
</MMR_ART_15>
